[
  {
    "name": "UploadsDownload delegates through DownloadURL primitive",
    "description": "Convenience method fetches upload metadata, extracts download_url, then delegates to the authenticated download primitive. Expect three requests: the metadata fetch (auth'd), hop 1 of the download (auth'd, 302s), and hop 2 (signed, unauthenticated). The Location is relative so hop 2 hits the same mock server.",
    "operation": "UploadsDownload",
    "method": "GET",
    "path": "/uploads/1069479400",
    "pathParams": {"uploadId": 1069479400},
    "mockResponses": [
      {"status": 200, "headers": {"Content-Type": "application/json"}, "body": {"id": 1069479400, "status": "active", "visible_to_clients": false, "created_at": "2022-11-22T08:35:00.000Z", "updated_at": "2022-11-22T08:35:00.000Z", "title": "logo.png", "inherits_status": true, "type": "Upload", "url": "https://3.basecampapi.com/999999999/buckets/2085958500/uploads/1069479400.json", "app_url": "https://3.basecamp.com/999999999/buckets/2085958500/uploads/1069479400", "bookmark_url": "https://3.basecampapi.com/999999999/my/bookmarks/BAh7CEkiCGdpZAY6BkVUSSIuZ2lkOi8vYmMzL1JlY29yZGluZy8xMDY5NDc5NDAwP2V4cGlyZXNfaW4GOwBUSSIMcHVycG9zZQY7AFRJIg1yZWFkYWJsZQY7AFRJIg9leHBpcmVzX2F0BjsAVDA=--abcd1234.json", "subscription_url": "https://3.basecampapi.com/999999999/buckets/2085958500/recordings/1069479400/subscription.json", "comments_count": 1, "comments_url": "https://3.basecampapi.com/999999999/buckets/2085958500/recordings/1069479400/comments.json", "position": 1, "parent": {"id": 1069479098, "title": "Docs & Files", "type": "Vault", "url": "https://3.basecampapi.com/999999999/buckets/2085958500/vaults/1069479098.json", "app_url": "https://3.basecamp.com/999999999/buckets/2085958500/vaults/1069479098"}, "bucket": {"id": 2085958500, "name": "The Leto Laptop", "type": "Project"}, "creator": {"id": 1049715915, "attachable_sgid": "BAh7CEkiCGdpZAY6BkVUSSIrZ2lkOi8vYmMzL1BlcnNvbi8xMDQ5NzE1OTE1P2V4cGlyZXNfaW4GOwBUSSIMcHVycG9zZQY7AFRJIg9hdHRhY2hhYmxlBjsAVEkiD2V4cGlyZXNfYXQGOwBUMA==--abcd1234", "name": "Victor Cooper", "email_address": "victor@honchodesign.com", "personable_type": "User", "title": "Chief Strategist", "bio": "Don't let your dreams be dreams", "location": "Chicago, IL", "created_at": "2022-11-22T08:23:21.000Z", "updated_at": "2022-11-22T08:23:21.000Z", "admin": true, "owner": true, "client": false, "employee": true, "time_zone": "America/Chicago", "avatar_url": "https://3.basecamp-static.com/195539477/people/BAhpBMpkkT4=--5520caeec1845b5a20c5b41d2c9de6578bcbb83d/avatar?v=1", "can_manage_projects": true, "can_manage_people": true}, "description": "Company logo in high resolution", "content_type": "image/png", "byte_size": 245678, "width": 1024.0, "height": 768.0, "download_url": "https://storage.3.basecamp.com/999999999/blobs/abcd1234/download/logo.png", "filename": "logo.png", "description_attachments": [{"id": 1069480020, "sgid": "BAh7CEkiCGdpZAY6BkVUSSIsZ2lkOi8vYmMzL0FjdGl2ZVN0b3JhZ2U6OkJsb2IvMTA2OTQ4MDAyMAY6BkVU--upl0ad01", "filename": "brand-guide.png", "content_type": "image/png", "byte_size": 512000, "download_url": "https://3.basecampapi.com/999999999/blobs/BAh7CEkiCGdpZAY6BkVUSSIsZ2lkOi8vYmMzL0FjdGl2ZVN0b3JhZ2U6OkJsb2IvMTA2OTQ4MDAyMAY6BkVU--upl0ad01/download/brand-guide.png", "width": 1024.0, "height": 768, "previewable": true, "preview_url": "https://3.basecampapi.com/999999999/blobs/BAh7CEkiCGdpZAY6BkVUSSIsZ2lkOi8vYmMzL0FjdGl2ZVN0b3JhZ2U6OkJsb2IvMTA2OTQ4MDAyMAY6BkVU--upl0ad01/previews/brand-guide.png", "thumbnail_url": "https://3.basecampapi.com/999999999/blobs/BAh7CEkiCGdpZAY6BkVUSSIsZ2lkOi8vYmMzL0FjdGl2ZVN0b3JhZ2U6OkJsb2IvMTA2OTQ4MDAyMAY6BkVU--upl0ad01/thumbnails/brand-guide.png"}, {"id": 1069480021, "sgid": "BAh7CEkiCGdpZAY6BkVUSSIsZ2lkOi8vYmMzL0FjdGl2ZVN0b3JhZ2U6OkJsb2IvMTA2OTQ4MDAyMQY6BkVU--upl0ad02", "filename": "specs.pdf", "content_type": "application/pdf", "byte_size": 2097152, "download_url": "https://3.basecampapi.com/999999999/blobs/BAh7CEkiCGdpZAY6BkVUSSIsZ2lkOi8vYmMzL0FjdGl2ZVN0b3JhZ2U6OkJsb2IvMTA2OTQ4MDAyMQY6BkVU--upl0ad02/download/specs.pdf", "width": null, "height": null, "previewable": false, "preview_url": "https://3.basecampapi.com/999999999/blobs/BAh7CEkiCGdpZAY6BkVUSSIsZ2lkOi8vYmMzL0FjdGl2ZVN0b3JhZ2U6OkJsb2IvMTA2OTQ4MDAyMQY6BkVU--upl0ad02/previews/specs.pdf", "thumbnail_url": "https://3.basecampapi.com/999999999/blobs/BAh7CEkiCGdpZAY6BkVUSSIsZ2lkOi8vYmMzL0FjdGl2ZVN0b3JhZ2U6OkJsb2IvMTA2OTQ4MDAyMQY6BkVU--upl0ad02/thumbnails/specs.pdf"}]}},
      {"status": 302, "headers": {"Location": "/signed/logo.png"}},
      {"status": 200, "headers": {"Content-Type": "image/png"}, "body": "pixels"}
    ],
    "assertions": [
      {"type": "requestCount", "expected": 3},
      {"type": "noError"},
      {"type": "headerPresent", "path": "Authorization", "index": 0},
      {"type": "headerPresent", "path": "Authorization", "index": 1},
      {"type": "headerAbsent", "path": "Authorization", "index": -1}
    ],
    "tags": ["upload", "download", "redirect"]
  },
  {
    "name": "UploadsDownload errors when upload has no download_url",
    "description": "If the API returns upload metadata with no download_url, the SDK raises a usage error after the metadata fetch. No download hop should fire.",
    "operation": "UploadsDownload",
    "method": "GET",
    "path": "/uploads/1069479400",
    "pathParams": {"uploadId": 1069479400},
    "mockResponses": [
      {"status": 200, "headers": {"Content-Type": "application/json"}, "body": {"id": 1069479400, "status": "active", "visible_to_clients": false, "created_at": "2022-11-22T08:35:00.000Z", "updated_at": "2022-11-22T08:35:00.000Z", "title": "logo.png", "inherits_status": true, "type": "Upload", "url": "https://3.basecampapi.com/999999999/buckets/2085958500/uploads/1069479400.json", "app_url": "https://3.basecamp.com/999999999/buckets/2085958500/uploads/1069479400", "bookmark_url": "https://3.basecampapi.com/999999999/my/bookmarks/BAh7CEkiCGdpZAY6BkVUSSIuZ2lkOi8vYmMzL1JlY29yZGluZy8xMDY5NDc5NDAwP2V4cGlyZXNfaW4GOwBUSSIMcHVycG9zZQY7AFRJIg1yZWFkYWJsZQY7AFRJIg9leHBpcmVzX2F0BjsAVDA=--abcd1234.json", "subscription_url": "https://3.basecampapi.com/999999999/buckets/2085958500/recordings/1069479400/subscription.json", "comments_count": 1, "comments_url": "https://3.basecampapi.com/999999999/buckets/2085958500/recordings/1069479400/comments.json", "position": 1, "parent": {"id": 1069479098, "title": "Docs & Files", "type": "Vault", "url": "https://3.basecampapi.com/999999999/buckets/2085958500/vaults/1069479098.json", "app_url": "https://3.basecamp.com/999999999/buckets/2085958500/vaults/1069479098"}, "bucket": {"id": 2085958500, "name": "The Leto Laptop", "type": "Project"}, "creator": {"id": 1049715915, "attachable_sgid": "BAh7CEkiCGdpZAY6BkVUSSIrZ2lkOi8vYmMzL1BlcnNvbi8xMDQ5NzE1OTE1P2V4cGlyZXNfaW4GOwBUSSIMcHVycG9zZQY7AFRJIg9hdHRhY2hhYmxlBjsAVEkiD2V4cGlyZXNfYXQGOwBUMA==--abcd1234", "name": "Victor Cooper", "email_address": "victor@honchodesign.com", "personable_type": "User", "title": "Chief Strategist", "bio": "Don't let your dreams be dreams", "location": "Chicago, IL", "created_at": "2022-11-22T08:23:21.000Z", "updated_at": "2022-11-22T08:23:21.000Z", "admin": true, "owner": true, "client": false, "employee": true, "time_zone": "America/Chicago", "avatar_url": "https://3.basecamp-static.com/195539477/people/BAhpBMpkkT4=--5520caeec1845b5a20c5b41d2c9de6578bcbb83d/avatar?v=1", "can_manage_projects": true, "can_manage_people": true}, "description": "Company logo in high resolution", "content_type": "image/png", "byte_size": 245678, "width": 1024.0, "height": 768.0, "download_url": null, "filename": "logo.png", "description_attachments": [{"id": 1069480020, "sgid": "BAh7CEkiCGdpZAY6BkVUSSIsZ2lkOi8vYmMzL0FjdGl2ZVN0b3JhZ2U6OkJsb2IvMTA2OTQ4MDAyMAY6BkVU--upl0ad01", "filename": "brand-guide.png", "content_type": "image/png", "byte_size": 512000, "download_url": "https://3.basecampapi.com/999999999/blobs/BAh7CEkiCGdpZAY6BkVUSSIsZ2lkOi8vYmMzL0FjdGl2ZVN0b3JhZ2U6OkJsb2IvMTA2OTQ4MDAyMAY6BkVU--upl0ad01/download/brand-guide.png", "width": 1024.0, "height": 768, "previewable": true, "preview_url": "https://3.basecampapi.com/999999999/blobs/BAh7CEkiCGdpZAY6BkVUSSIsZ2lkOi8vYmMzL0FjdGl2ZVN0b3JhZ2U6OkJsb2IvMTA2OTQ4MDAyMAY6BkVU--upl0ad01/previews/brand-guide.png", "thumbnail_url": "https://3.basecampapi.com/999999999/blobs/BAh7CEkiCGdpZAY6BkVUSSIsZ2lkOi8vYmMzL0FjdGl2ZVN0b3JhZ2U6OkJsb2IvMTA2OTQ4MDAyMAY6BkVU--upl0ad01/thumbnails/brand-guide.png"}, {"id": 1069480021, "sgid": "BAh7CEkiCGdpZAY6BkVUSSIsZ2lkOi8vYmMzL0FjdGl2ZVN0b3JhZ2U6OkJsb2IvMTA2OTQ4MDAyMQY6BkVU--upl0ad02", "filename": "specs.pdf", "content_type": "application/pdf", "byte_size": 2097152, "download_url": "https://3.basecampapi.com/999999999/blobs/BAh7CEkiCGdpZAY6BkVUSSIsZ2lkOi8vYmMzL0FjdGl2ZVN0b3JhZ2U6OkJsb2IvMTA2OTQ4MDAyMQY6BkVU--upl0ad02/download/specs.pdf", "width": null, "height": null, "previewable": false, "preview_url": "https://3.basecampapi.com/999999999/blobs/BAh7CEkiCGdpZAY6BkVUSSIsZ2lkOi8vYmMzL0FjdGl2ZVN0b3JhZ2U6OkJsb2IvMTA2OTQ4MDAyMQY6BkVU--upl0ad02/previews/specs.pdf", "thumbnail_url": "https://3.basecampapi.com/999999999/blobs/BAh7CEkiCGdpZAY6BkVUSSIsZ2lkOi8vYmMzL0FjdGl2ZVN0b3JhZ2U6OkJsb2IvMTA2OTQ4MDAyMQY6BkVU--upl0ad02/thumbnails/specs.pdf"}]}}
    ],
    "assertions": [
      {"type": "requestCount", "expected": 1},
      {"type": "errorMessage", "expected": "has no download"}
    ],
    "tags": ["upload", "download", "error"]
  }
]
